school-trust,name,type,is-umbrella,organisation,edubase-school-trust,company,company-name
2385,Winifred Holtby Academy Trust,single-academy trust,,,,company:08426992,WINIFRED HOLTBY ACADEMY TRUST
2386,Woodside Primary School,single-academy trust,,,,company:08239113,WOODSIDE PRIMARY SCHOOL
2387,ContinU Plus Academy Trust,single-academy trust,,,,company:08228379,CONTINU PLUS ACADEMY TRUST
2388,Holy Family Catholic Academy,single-academy trust,,,,company:08623002,HOLY FAMILY CATHOLIC ACADEMY
2389,"Harmony Trust Limited, The",multi-academy trust,,company:08840373,3316,company:08840373,THE HARMONY TRUST LTD
2390,CCT Learning,single-academy trust,,,,company:07962209,CCT LEARNING
2391,Steiner Academy Exeter,single-academy trust,,,,company:07956691,STEINER ACADEMY EXETER
2392,Reach Learning Limited,single-academy trust,,,,company:07311261,REACH LEARNING LIMITED
2393,Sir Thomas Fremantle School,single-academy trust,,,,company:07955870,SIR THOMAS FREMANTLE SCHOOL
2394,"Engage Multi Academy Trust, The",multi-academy trust,,company:08699493,5646,company:08699493,THE ENGAGE MULTI ACADEMY TRUST
2395,Devon Studio School,single-academy trust,,,,company:07941664,DEVON STUDIO SCHOOL
2396,Sussex Education Trust Ltd,single-academy trust,,,,company:07874411,SUSSEX EDUCATION TRUST LTD
2397,Bristol and South Gloucestershire UTC,single-academy trust,,,,company:07638089,BRISTOL AND SOUTH GLOUCESTERSHIRE UTC
2398,"Reach Free School Trust, The",single-academy trust,,,,company:07960515,THE REACH FREE SCHOOL TRUST
2399,City Education Trust,multi-academy trust,,company:08528776,2703,company:08528776,CITY EDUCATION TRUST
2400,"Ted Wragg Multi Academy Trust, The",multi-academy trust,,company:08545109,4909,company:08545109,THE TED WRAGG MULTI ACADEMY TRUST
2401,Liverpool College Independent School Trust,single-academy trust,,,,company:08565932,LIVERPOOL COLLEGE INDEPENDENT SCHOOL TRUST
2402,South London Jewish Primary School,single-academy trust,,,,company:07864383,SOUTH LONDON JEWISH PRIMARY SCHOOL
2403,Khalsa Education Trust,single-academy trust,,,,company:07954683,KHALSA EDUCATION TRUST
2404,"Silverstone Academy Trust, The",single-academy trust,,,,company:07649183,THE SILVERSTONE ACADEMY TRUST
2405,"Sheffield UTC Academy Trust, The",multi-academy trust,,company:07652696,16038,company:07652696,THE SHEFFIELD UTC ACADEMY TRUST
2406,"Wells Free School, The",single-academy trust,,,,company:07923267,THE WELLS FREE SCHOOL
2407,Hadlow Rural Community School Limited,single-academy trust,,,,company:07645462,HADLOW RURAL COMMUNITY SCHOOL LIMITED
2408,Chobham School Academy (Stratford),single-academy trust,,,,company:06846720,CHOBHAM SCHOOL ACADEMY (STRATFORD)
2409,Talent & Enterprise Trust,multi-academy trust,,company:08562954,4893,company:08562954,TALENT & ENTERPRISE TRUST
2410,"Good Shepherd Trust, The",multi-academy trust,,company:08366199,3201,company:08366199,THE GOOD SHEPHERD TRUST
2411,Orchard Hill College Academy Trust,multi-academy trust,,company:08476149,4100,company:08476149,ORCHARD HILL COLLEGE ACADEMY TRUST
2412,NAS Academies Trust,multi-academy trust,,company:07954396,3956,company:07954396,NAS ACADEMIES TRUST
2413,West Newcastle Academy,multi-academy trust,,company:07647538,5273,company:07647538,WEST NEWCASTLE ACADEMY
2414,"Titan Partnership Trust Limited, The",single-academy trust,,,,company:07947806,THE TITAN PARTNERSHIP TRUST LIMITED
2415,St. Anselm's Catholic Multi Academy Trust,multi-academy trust,,company:08515862,4629,company:08515862,ST. ANSELM'S CATHOLIC MULTI ACADEMY TRUST
2416,Arden Grove Infant and Nursery School,single-academy trust,,,,company:08510814,ARDEN GROVE INFANT AND NURSERY SCHOOL
2417,Battling Brook Primary School,single-academy trust,,,,company:08512087,BATTLING BROOK PRIMARY SCHOOL
2418,"Leap Academy Trust, The",multi-academy trust,,company:08482129,3708,company:08482129,THE LEAP ACADEMY TRUST
2419,Brocks Hill Academy Trust,single-academy trust,,,,company:08511781,BROCKS HILL ACADEMY TRUST
2420,Acorn Academy Cornwall,multi-academy trust,,company:08418341,2067,company:08418341,ACORN ACADEMY CORNWALL
2421,"Blyth Quays Trust, The",multi-academy trust,,company:08428466,2365,company:08428466,THE BLYTH QUAYS TRUST
2422,Frisby C.E. Primary School,single-academy trust,,,,company:08527173,FRISBY C.E. PRIMARY SCHOOL
2423,Hamstead Hall Academy Trust,multi-academy trust,,company:08528845,3303,company:08528845,HAMSTEAD HALL ACADEMY TRUST
2424,Edwin Jones Trust,multi-academy trust + umbrella trust,,company:08512105,3019,company:08512105,EDWIN JONES TRUST
2425,Hamwic Trust,multi-academy trust + umbrella trust,yes,,,company:08508903,HAMWIC TRUST
2426,Heather Garth Primary School,single-academy trust,,,,company:08431840,HEATHER GARTH PRIMARY SCHOOL
2427,Honeybourne First School Academy,single-academy trust,,,,company:08496781,HONEYBOURNE FIRST SCHOOL ACADEMY
2428,Ladygrove Park Primary School,single-academy trust,,,,company:08517429,LADYGROVE PARK PRIMARY SCHOOL
2429,Launde Primary School Academy Trust,multi-academy trust,,company:08515149,3700,company:08515149,SCHOLARS ACADEMY TRUST
2430,Leighton Academy,single-academy trust,,,,company:08500778,LEIGHTON ACADEMY
2431,Malmesbury C of E Primary School,single-academy trust,,,,company:08483768,MALMESBURY C OF E PRIMARY SCHOOL
2432,Manor School Didcot Academy Trust,single-academy trust,,,,company:08516551,MANOR SCHOOL DIDCOT ACADEMY TRUST
2433,St John's Academy Trust,single-academy trust,,,,company:08517255,ST JOHN'S ACADEMY TRUST
2434,Mid Essex Anglican Academy Trust,multi-academy trust,,company:08524638,16036,company:08524638,MID ESSEX ANGLICAN ACADEMY TRUST
2435,"South Cheshire Catholic Multi-academy Trust, The",multi-academy trust + umbrella trust,,company:08518704,5693,company:08518704,THE SOUTH CHESHIRE CATHOLIC MULTI-ACADEMY TRUST
2436,"Nottingham Emmanuel School, The",single-academy trust,,,,company:08472283,THE NOTTINGHAM EMMANUEL SCHOOL
2437,Thringstone Primary School Academy Trust,single-academy trust,,,,company:08514901,THRINGSTONE PRIMARY SCHOOL ACADEMY TRUST
2438,William Brookes Academy Trust,single-academy trust,,,,company:08520569,WILLIAM BROOKES ACADEMY TRUST
2439,Willowcroft Academy Trust,single-academy trust,,,,company:08516562,WILLOWCROFT ACADEMY TRUST
2440,"Leeds Jewish Free School, The",single-academy trust,,,,company:07647432,THE LEEDS JEWISH FREE SCHOOL
2441,"Acorn EBS Free School Ltd., The",single-academy trust,,,,company:07654340,THE ACORN EBS FREE SCHOOL LTD.
2442,Bellevue Place Education Trust,multi-academy trust,,company:07956784,2288,company:07956784,BELLEVUE PLACE EDUCATION TRUST
2443,"Olive Tree Primary School Bolton Limited, The",single-academy trust,,,,company:07956473,THE OLIVE TREE PRIMARY SCHOOL BOLTON LIMITED
2444,NCB Studio School,single-academy trust,,,,company:07960235,NCB STUDIO SCHOOL
2445,Active Education Academy Trust,single-academy trust,,,,company:07650619,ACTIVE EDUCATION ACADEMY TRUST
2446,"University Technical College, Royal Borough of Greenwich, The",single-academy trust,,,,company:07742547,"THE UNIVERSITY TECHNICAL COLLEGE, ROYAL BOROUGH OF GREENWICH"
2447,"Waverley Education Foundation Ltd, The",multi-academy trust,,company:08331922,5232,company:08331922,THE WAVERLEY EDUCATION FOUNDATION LTD
2448,Walsall Studio School,single-academy trust,,,,company:08285206,WALSALL STUDIO SCHOOL
2449,Big Life Schools,multi-academy trust,,company:07945230,15759,company:07945230,BIG LIFE SCHOOLS
2450,Partnership Learning,multi-academy trust,,company:08339345,5485,company:08339345,PARTNERSHIP LEARNING
2451,UTC Lancashire,single-academy trust,,,,company:07653051,UTC LANCASHIRE
2452,Sparkwell All Saints Primary Trust Limited,single-academy trust,,,,company:07952925,SPARKWELL ALL SAINTS PRIMARY TRUST LIMITED
2453,Gildredge House Free School,single-academy trust,,,,company:08436285,GILDREDGE HOUSE FREE SCHOOL
2454,Bishop Cleary Catholic Multi Academy Company,multi-academy trust,,company:08578428,2328,company:08578428,BISHOP CLEARY CATHOLIC MULTI ACADEMY COMPANY
2455,Route 39 Academy Trust Limited,single-academy trust,,,,company:07945060,ROUTE 39 ACADEMY TRUST LIMITED
2456,East London Science School Trust,single-academy trust,,,,company:07962059,EAST LONDON SCIENCE SCHOOL TRUST
2457,Biddick Academy Trust,multi-academy trust,,company:08521080,2307,company:08521080,BIDDICK ACADEMY TRUST
2458,Birchwood Community Academy Trust,single-academy trust,,,,company:08426967,BIRCHWOOD COMMUNITY ACADEMY TRUST
2459,Broadway Academy Trust,single-academy trust,,,,company:08534233,BROADWAY ACADEMY TRUST
2460,Burntwood School,single-academy trust,,,,company:08550180,BURNTWOOD SCHOOL
2461,"Diocese of Ely Multi-academy Trust, The",multi-academy trust,,company:08464996,2905,company:08464996,THE DIOCESE OF ELY MULTI-ACADEMY TRUST
2462,Carmountside Primary Academy,single-academy trust,,,,company:08170071,CARMOUNTSIDE PRIMARY ACADEMY
2463,South Northamptonshire Village Schools Multi Academy Trust,multi-academy trust,,company:08567252,4580,company:08567252,SOUTH NORTHAMPTONSHIRE VILLAGE SCHOOLS MULTI ACADEMY TRUST
2464,Diamond Hall Infant Academy,single-academy trust,,,,company:08565046,DIAMOND HALL INFANT ACADEMY
2465,Extol Academy Trust,multi-academy trust,,company:08561360,3071,company:08561360,EXTOL ACADEMY TRUST
2466,Brighter Academy Trust,multi-academy trust,,company:08557883,2440,company:08557883,BRIGHTER ACADEMY TRUST
2467,"Forest School Academy Trust, The",single-academy trust,,,,company:08563159,THE FOREST SCHOOL ACADEMY TRUST
2468,Gilmorton Chandler Church of England Primary School,single-academy trust,,,,company:08540699,GILMORTON CHANDLER CHURCH OF ENGLAND PRIMARY SCHOOL
2469,"Oadby, Wigston and Leicestershire Schools Academy Trust",multi-academy trust,,company:08537140,3185,company:08537140,"OADBY, WIGSTON AND LEICESTERSHIRE SCHOOLS ACADEMY TRUST"
2470,Brigantia Learning Trust Limited,multi-academy trust,,company:08506178,3431,company:08506178,BRIGANTIA LEARNING TRUST LIMITED
2471,Langham Church of England Primary School,single-academy trust,,,,company:08560721,LANGHAM CHURCH OF ENGLAND PRIMARY SCHOOL
2472,Loughton School,single-academy trust,,,,company:08565187,LOUGHTON SCHOOL
2473,Lound Academy Trust,multi-academy trust,,company:08550854,3794,company:08550854,LOUND ACADEMY TRUST
2474,Lubenham All Saints Church of England Primary School,single-academy trust,,,,company:08561329,LUBENHAM ALL SAINTS CHURCH OF ENGLAND PRIMARY SCHOOL
2475,Meppershall Church of England Academy,single-academy trust,,,,company:08572815,MEPPERSHALL CHURCH OF ENGLAND ACADEMY
2476,Norwood Green Junior School,single-academy trust,,,,company:08520286,NORWOOD GREEN JUNIOR SCHOOL
2477,Perry Hall Multi-Academy Trust,multi-academy trust,,company:08566185,4186,company:08566185,PERRY HALL MULTI-ACADEMY TRUST
2478,Connected Learning,multi-academy trust,,company:08579939,2771,company:08579939,CONNECTED LEARNING
2479,Redhill School,single-academy trust,,,,company:08536774,REDHILL SCHOOL
2480,Richard Hale School,single-academy trust,,,,company:08572898,RICHARD HALE SCHOOL
2481,Rothley Church of England Primary School,single-academy trust,,,,company:08388074,ROTHLEY CHURCH OF ENGLAND PRIMARY SCHOOL
2482,"St Bede's Catholic Primary School, A Voluntary Academy",single-academy trust + umbrella trust,,,,company:08543210,"ST BEDE'S CATHOLIC PRIMARY SCHOOL, A VOLUNTARY ACADEMY"
2483,St Gerard's Catholic Primary,single-academy trust + umbrella trust,,,,company:08543748,ST GERARD'S CATHOLIC PRIMARY
2484,St. Joseph's Catholic Education Trust,multi-academy trust,,company:08559647,4719,company:08559647,ST. JOSEPH'S CATHOLIC EDUCATION TRUST
2485,Saint Lawrence Church of England Primary School Hurstpierpoint,single-academy trust,,,,company:08514898,SAINT LAWRENCE CHURCH OF ENGLAND PRIMARY SCHOOL HURSTPIERPOINT
2486,"St Mary's Catholic Primary School (Herringthorpe), A Catholic Voluntary Academy",single-academy trust + umbrella trust,,,,company:08543115,"ST MARY'S CATHOLIC PRIMARY SCHOOL (HERRINGTHORPE), A CATHOLIC VOLUNTARY ACADEMY"
2487,St Mary's Catholic Primary School (Maltby),single-academy trust + umbrella trust,,,,company:08543217,ST MARY'S CATHOLIC PRIMARY SCHOOL (MALTBY)
2488,"Catholic Academy Trust in East Berkshire, The",multi-academy trust,,company:08561153,2579,company:08561153,THE CATHOLIC ACADEMY TRUST IN EAST BERKSHIRE
2489,"Learning Together Trust, The",multi-academy trust,,company:08561302,5669,company:08561302,THE LEARNING TOGETHER TRUST
2490,Washwood Heath Multi Academy Trust,multi-academy trust,,company:08531479,5226,company:08531479,WASHWOOD HEATH MULTI ACADEMY TRUST
2491,Westbrook Primary School,single-academy trust,,,,company:08523370,WESTBROOK PRIMARY SCHOOL
2492,"Robert Owen Academies Trust, The",single-academy trust,,,,company:08220540,THE ROBERT OWEN ACADEMIES TRUST
2493,The Khalsa Academies Trust Limited,multi-academy trust,,company:07549443,15763,company:07549443,THE KHALSA ACADEMIES TRUST LIMITED
2494,South Essex Community School Ltd,single-academy trust,,,,company:07954295,SOUTH ESSEX COMMUNITY SCHOOL LTD
2495,St Bart's Multi Academy Trust,multi-academy trust,,company:08735454,4638,company:08735454,ST BART'S MULTI ACADEMY TRUST
2496,RNIB Specialist Learning Trust,multi-academy trust,,company:08478985,4372,company:08478985,RNIB SPECIALIST LEARNING TRUST
2497,Diocese of Brentwood Multi Academy Trust,multi-academy trust,,company:08610377,2893,company:08610377,DIOCESE OF BRENTWOOD MULTI ACADEMY TRUST
2498,Plymouth School of Creative Arts,single-academy trust,,,,company:07953395,PLYMOUTH SCHOOL OF CREATIVE ARTS
2499,"Harrow Alternative Provision Academy Trust, The",single-academy trust,,,,company:07949213,THE HARROW ALTERNATIVE PROVISION ACADEMY TRUST
2500,Theale Green School Trust,single-academy trust,,,,company:08644023,THEALE GREEN SCHOOL TRUST
2501,University of Chichester (Multi) Academy Trust,multi-academy trust,,company:08595545,5153,company:08595545,UNIVERSITY OF CHICHESTER (MULTI) ACADEMY TRUST
2502,Solent Academies Trust,multi-academy trust,,company:08374351,4559,company:08374351,SOLENT ACADEMIES TRUST
2503,Collective Spirit Oldham,single-academy trust,,,,company:08178309,COLLECTIVE SPIRIT OLDHAM
2504,Holyport College,single-academy trust,,,,company:07930340,HOLYPORT COLLEGE
2505,The Heights Primary School,single-academy trust,,,,company:08334593,THE HEIGHTS PRIMARY SCHOOL
2506,Horizons Specialist Academy Trust,multi-academy trust,,company:08608287,3483,company:08608287,HORIZONS SPECIALIST ACADEMY TRUST
2507,Beckfoot Trust,multi-academy trust,,company:08155088,2270,company:08155088,BECKFOOT TRUST
2508,Hartlepool Aspire Trust,multi-academy trust,,company:08604037,3329,company:08604037,HARTLEPOOL ASPIRE TRUST
2509,"Southfield Grange Trust, The",multi-academy trust,,company:07754077,4593,company:07754077,THE SOUTHFIELD GRANGE TRUST
2510,Dauntsey Academy Primary School,single-academy trust,,,,company:08602255,DAUNTSEY ACADEMY PRIMARY SCHOOL
2511,Odyssey Educational Trust,multi-academy trust,,company:08612100,16096,company:08612100,ODYSSEY EDUCATIONAL TRUST
2512,Koinonia Academies Trust,multi-academy trust,,company:08563153,3668,company:08563153,KOINONIA ACADEMIES TRUST
2513,Stone with Woodford C of E Primary School,single-academy trust,,,,company:08576916,STONE WITH WOODFORD C OF E PRIMARY SCHOOL
2514,"Ferrers School, The",single-academy trust,,,,company:08621334,THE FERRERS SCHOOL
2515,"Green School Trust, The",multi-academy trust + umbrella trust,,company:08608665,3240,company:08608665,THE GREEN SCHOOL TRUST
2516,London Diocesan Board for Schools,multi-academy trust + umbrella trust,yes,,,company:00198131,LONDON DIOCESAN BOARD FOR SCHOOLS(THE)
2517,Ursula Taylor Church of England School,single-academy trust,,,,company:08606536,URSULA TAYLOR CHURCH OF ENGLAND SCHOOL
2518,West Thurrock Academy,single-academy trust,,,,company:08259069,WEST THURROCK ACADEMY
2519,Wingfield Academy,single-academy trust,,,,company:08550403,WINGFIELD ACADEMY
2520,Woking High School Academy Trust,single-academy trust,,,,company:08586085,WOKING HIGH SCHOOL ACADEMY TRUST
2521,Yardleys School,single-academy trust,,,,company:08496504,YARDLEYS SCHOOL
2522,"Heyfordian School Trust, The",single-academy trust,,,,company:07926597,THE HEYFORDIAN SCHOOL TRUST
2523,Bury College Education Trust,multi-academy trust,,company:08769073,2507,company:08769073,BURY COLLEGE EDUCATION TRUST
2524,Durham Free School Limited,single-academy trust,,,,company:07959449,DURHAM FREE SCHOOL LTD
2525,OUR Co-operative Academies Trust,multi-academy trust,,company:08670427,4111,company:08670427,OUR CO-OPERATIVE ACADEMIES TRUST
2526,"Hallam Schools' Partnership Academy Trust, The",multi-academy trust,,company:08665067,3294,company:08665067,THE HALLAM SCHOOLS' PARTNERSHIP ACADEMY TRUST
2527,Lumen Learning Trust,multi-academy trust,,company:08670599,3805,company:08670599,LUMEN LEARNING TRUST
2528,Downview Trust,multi-academy trust,,company:08603388,2953,company:08603388,DOWNVIEW TRUST
2529,Westfield Academy,single-academy trust,,,,company:08526440,WESTFIELD ACADEMY
2530,Gateway Academy,single-academy trust,,,,company:08556180,GATEWAY ACADEMY
2531,Acorn Trust,multi-academy trust,,company:08638158,2072,company:08638158,ACORN TRUST
2532,Wardle Academy,multi-academy trust,,company:08368756,5486,company:08368756,WARDLE ACADEMY
2533,South Northamptonshire Church of England Multi Academy Trust,multi-academy trust,,company:08569207,4579,company:08569207,SOUTH NORTHAMPTONSHIRE CHURCH OF ENGLAND MULTI ACADEMY TRUST
2534,Fareham Academy,single-academy trust,,,,company:08549807,FAREHAM ACADEMY
2535,Harden Primary School,single-academy trust,,,,company:08610504,HARDEN PRIMARY SCHOOL
2536,Three Ways School,single-academy trust,,,,company:08488749,THREE WAYS SCHOOL
2537,Alexandra Junior School,single-academy trust,,,,company:08621035,ALEXANDRA JUNIOR SCHOOL
2538,St. Mary's Catholic School Trust,multi-academy trust,,company:08599141,4750,company:08599141,ST. MARY'S CATHOLIC SCHOOL TRUST
2539,Highfield Infants' School,single-academy trust,,,,company:08632733,HIGHFIELD INFANTS' SCHOOL
2540,Holmes Chapel Primary School,single-academy trust,,,,company:08587865,HOLMES CHAPEL PRIMARY SCHOOL
2541,"Horsell Village School, The",single-academy trust,,,,company:08622047,THE HORSELL VILLAGE SCHOOL
2542,Raglan Primary School,single-academy trust,,,,company:08628905,RAGLAN PRIMARY SCHOOL
2543,"Oaktree School Academy Trust, The",single-academy trust,,,,company:08638766,THE OAKTREE SCHOOL ACADEMY TRUST
2544,Hollingworth Academy Trust,single-academy trust,,,,company:08314692,HOLLINGWORTH ACADEMY TRUST
2545,Torre Church of England Academy,single-academy trust,,,,company:08594520,TORRE CHURCH OF ENGLAND ACADEMY
2546,Cloughwood Academy Trust,multi-academy trust,,company:08604799,2727,company:08604799,CLOUGHWOOD ACADEMY TRUST
2547,Old Dalby Church of England Primary School,single-academy trust,,,,company:08564471,OLD DALBY CHURCH OF ENGLAND PRIMARY SCHOOL
2548,Over Hall Academies Limited,single-academy trust,,,,company:09476660,OVER HALL ACADEMIES LIMITED
2549,Milford-on-Sea Church of England Primary School Academy Trust,single-academy trust,,,,company:08612061,MILFORD-ON-SEA CHURCH OF ENGLAND PRIMARY SCHOOL ACADEMY TRUST
2550,Hastings High School,single-academy trust,,,,company:08617343,HASTINGS HIGH SCHOOL
2551,Eggbuckland Community College Academy Trust,multi-academy trust,,company:08603078,5595,company:08603078,EGGBUCKLAND COMMUNITY COLLEGE ACADEMY TRUST
2552,Alsager Multi Academy Trust,multi-academy trust,,company:08597784,2122,company:08597784,ALSAGER MULTI ACADEMY TRUST
2553,White Woods Primary Academy Trust,multi-academy trust,,company:08589470,5318,company:08589470,WHITE WOODS PRIMARY ACADEMY TRUST
2554,Darrington Church of England Primary School,single-academy trust + umbrella trust,,,,company:08638398,DARRINGTON CHURCH OF ENGLAND PRIMARY SCHOOL
2555,IQRA Academy Education Trust,single-academy trust,,,,company:08623229,IQRA ACADEMY EDUCATION TRUST
2556,MVW Academy,single-academy trust,,,,company:08634384,MVW ACADEMY
2557,"Newman Catholic Collegiate, The",multi-academy trust,,company:08550110,3991,company:08550110,THE NEWMAN CATHOLIC COLLEGIATE
2558,Surrey Heath Education Trust,multi-academy trust,,company:08621310,4876,company:08621310,SURREY HEATH EDUCATION TRUST
2559,Alleyne's Academy,single-academy trust,,,,company:08611863,ALLEYNE'S ACADEMY
2560,Blackpool Multi Academy Trust,multi-academy trust,,company:08597962,2350,company:08597962,BLACKPOOL MULTI ACADEMY TRUST
2561,Heartwood Church of England Academy Trust,multi-academy trust,,company:08627834,3371,company:08627834,HEARTWOOD CHURCH OF ENGLAND ACADEMY TRUST
2562,"St John Bosco Catholic Academy, The",multi-academy trust,,company:08608177,4703,company:08608177,THE ST JOHN BOSCO CATHOLIC ACADEMY
2563,Cawston Grange Primary School,single-academy trust,,,,company:08599777,CAWSTON GRANGE PRIMARY SCHOOL
2564,Kingsway Community Trust,multi-academy trust,,company:08339302,3652,company:08339302,KINGSWAY COMMUNITY TRUST
2565,Haltwhistle Community Campus,multi-academy trust,,company:08624157,3295,company:08624157,HALTWHISTLE COMMUNITY CAMPUS
2566,Holland Park School,single-academy trust,,,,company:08588099,HOLLAND PARK SCHOOL
2567,Henley-In-Arden Church of England Primary School,single-academy trust,,,,company:08644320,HENLEY-IN-ARDEN CHURCH OF ENGLAND PRIMARY SCHOOL
2568,Jubilee Park Academy Trust,single-academy trust,,,,company:08591050,JUBILEE PARK ACADEMY TRUST
2569,Ocker Hill Academy Trust,single-academy trust,,,,company:08593820,OCKER HILL ACADEMY TRUST
2570,Park Road Sale Primary School,single-academy trust,,,,company:08623343,PARK ROAD SALE PRIMARY SCHOOL
2571,Madeley High School Academy Trust,single-academy trust,,,,company:08621160,MADELEY HIGH SCHOOL ACADEMY TRUST
2572,West Midlands Construction UTC,single-academy trust,,,,company:07898669,WEST MIDLANDS CONSTRUCTION UTC
2573,William Temple Multi Academy Trust,multi-academy trust,,company:08813173,5345,company:08813173,WILLIAM TEMPLE MULTI ACADEMY TRUST
2574,"Diocese of Chelmsford Vine Schools Trust, The",multi-academy trust,,company:08709542,4955,company:08709542,THE DIOCESE OF CHELMSFORD VINE SCHOOLS TRUST
2575,The Diocese of Chelmsford Sower Schools Trust,multi-academy trust,,,,company:08709656,THE DIOCESE OF CHELMSFORD SOWER SCHOOLS TRUST
2576,Chesterton Academy Trust,multi-academy trust,,company:08786812,2650,company:08786812,CHESTERTON ACADEMY TRUST
2577,Whitefield Academy Trust,multi-academy trust,,company:08878604,5320,company:08878604,WHITEFIELD ACADEMY TRUST
2578,Langdale Free School,single-academy trust,,,,company:07649550,LANGDALE FREE SCHOOL
2579,Westside Academy Trust,single-academy trust,,,,company:05888220,WESTSIDE ACADEMY TRUST
2580,St Anthony's Free School,single-academy trust,,,,company:08232396,ST ANTHONY'S FREE SCHOOL
2581,Peaslake Free School Limited,single-academy trust,,,,company:07925067,PEASLAKE FREE SCHOOL LIMITED
2582,Bradford Girls' Grammar School Trust,single-academy trust,,,,company:07951118,BRADFORD GIRLS' GRAMMAR SCHOOL TRUST
2583,Kensington Aldridge Academy,single-academy trust,,,,company:07702460,KENSINGTON ALDRIDGE ACADEMY
2584,Macintyre Academies,multi-academy trust,,company:08334745,3817,company:08334745,MACINTYRE ACADEMIES
2585,South Bank Academies,multi-academy trust,,company:08589525,5148,company:08589525,SOUTH BANK ACADEMIES
2586,Clifton All Saints Academy,single-academy trust,,,,company:08702006,CLIFTON ALL SAINTS ACADEMY
2587,Appleton Primary School,single-academy trust,,,,company:08682513,APPLETON PRIMARY SCHOOL
2588,Hall Orchard Barrow CE Primary School,single-academy trust,,,,company:08674696,HALL ORCHARD BARROW CE PRIMARY SCHOOL
2589,Blue Bell Hill Academy Trust,multi-academy trust,,company:08554393,2358,company:08554393,BLUE BELL HILL ACADEMY TRUST
2590,St Barnabas Church of England Multi Academy Trust,multi-academy trust + umbrella trust,,company:08669464,4636,company:08669464,ST BARNABAS CHURCH OF ENGLAND MULTI ACADEMY TRUST
2591,Bricknell Primary School,single-academy trust,,,,company:08682863,BRICKNELL PRIMARY SCHOOL
2592,Broadfields Academy Trust,single-academy trust,,,,company:08640614,BROADFIELDS ACADEMY TRUST
2593,Countess Anne Church of England School,single-academy trust,,,,company:08658210,COUNTESS ANNE CHURCH OF ENGLAND SCHOOL
2594,"Specialist Education Trust, The",multi-academy trust,,company:08610537,4608,company:08610537,THE SPECIALIST EDUCATION TRUST
2595,Hoyland Common Primary School,single-academy trust,,,,company:08654591,HOYLAND COMMON PRIMARY SCHOOL
2596,Hurst Primary School,single-academy trust,,,,company:08657975,HURST PRIMARY SCHOOL
2597,Longhill Primary School,single-academy trust,,,,company:08684289,LONGHILL PRIMARY SCHOOL
2598,Maybury Primary School,single-academy trust,,,,company:08682547,MAYBURY PRIMARY SCHOOL
2599,Neasden Primary School,single-academy trust,,,,company:08682479,NEASDEN PRIMARY SCHOOL
2600,"Futures Trust, The",multi-academy trust,,company:08678162,15732,company:08678162,THE FUTURES TRUST
2601,Ralph Sadleir School,multi-academy trust,,company:08663956,4301,company:08663956,RALPH SADLEIR SCHOOL
2602,Stanton Under Bardon Community Primary School,single-academy trust,,,,company:08423592,STANTON UNDER BARDON COMMUNITY PRIMARY SCHOOL
2603,Thornton Community Primary School,single-academy trust,,,,company:08430135,THORNTON PRIMARY SCHOOL
2604,Thrybergh Academy & Sports College,single-academy trust,,,,company:08290708,THRYBERGH ACADEMY & SPORTS COLLEGE
2605,Connaught Academy Trust,single-academy trust,,,,company:08576427,CONNAUGHT ACADEMY TRUST
2606,Highfield Junior School,single-academy trust,,,,company:08657831,HIGHFIELD JUNIOR SCHOOL
2607,Astwood Bank First School,single-academy trust,,,,company:08637890,ASTWOOD BANK FIRST SCHOOL
2608,Cheam Park Farm Infants School,single-academy trust,,,,company:08661374,CHEAM PARK FARM INFANTS SCHOOL
2609,Regency High School,single-academy trust,,,,company:08658515,REGENCY HIGH SCHOOL
2610,Robin Hood Academy,single-academy trust,,,,,
2611,UTC Cambridge,single-academy trust,,,,company:07911604,UTC CAMBRIDGE
