school-trust,name,type,is-umbrella,organisation,edubase-school-trust,company,company-name
1,Eltham Green School Trust,trust,,,,,
2,*Co-op Brent Knoll and Watergate Co-operative Trust,trust,,,,company:08002136,BRENT KNOLL AND WATERGATE CO-OPERATIVE TRUST
3,The Academies Enterprise Trust,trust,,,,company:06625091,ACADEMIES ENTERPRISE TRUST
4,The Copland Learning Partnership Trust,trust,,,,,
5,The Bourne Foundation,trust,,,,,
6,The Liverpool Joint Catholic and Church of England Academies Trust,multi-academy trust,,company:07007398,15885,company:07007398,THE LIVERPOOL JOINT CATHOLIC AND CHURCH OF ENGLAND ACADEMIES TRUST
7,The Buxton School Learning Trust,trust,,,,company:06933903,BUXTON SCHOOL LEARNING TRUST
8,Four Oaks Learning Trust For Excellence,trust,,,,company:08530062,FOUR OAKS LEARNING TRUST FOR EXCELLENCE
9,The Endeavour Co-operative Learning Trust,trust,,,,company:09095872,THE ENDEAVOUR CO-OPERATIVE LEARNING TRUST
10,The Quinton Co-operative Learning Village Trust,trust,,,,company:07361097,THE QUINTON CO-OPERATIVE LEARNING VILLAGE TRUST
11,Mainland Trust,trust,,,,company:07640639,MAINLAND TRUST
12,The Selly Oak School Trust,trust,,,,company:06318425,THE REAL LIFE 4 ME TRUST
13,Stoke Park School Trust,trust,,,,company:06645806,STOKE PARK SCHOOL TRUST
14,Foxford School Trust Limited,trust,,,,company:07175341,FOXFORD SCHOOL TRUST
15,The Stourbridge Educational Trust,trust,,,,company:06699254,THE STOURBRIDGE EDUCATIONAL TRUST LIMITED
16,The Coseley Co-operative Learning Trust,trust,,,,company:08510454,THE COSELEY CO-OPERATIVE LEARNING TRUST
17,Peoples Field Trust,trust,,,,company:08572909,THE PEOPLES FIELD TRUST
18,Wednesday Learning Community Trust,trust,,,,,
19,The Rowley Learning Trust,trust,,,,company:08124820,THE ROWLEY LEARNING TRUST
20,Moat Farm Junior School Trust,trust,,,,company:07487384,THE MOAT FARM JUNIOR SCHOOL TRUST
21,The Sandwell Excellence Trust,trust,,,,company:07112404,SANDWELL EXCELLENCE TRUST
22,The Smethwick Health and Wellbeing Education Trust,trust,,,,company:06803262,SMETHWICK HEALTH AND WELLBEING EDUCATION TRUST
23,Lyndon School Humanities Trust Board,trust,,,,,
24,The Frank F Harrison Trust in the Beechdale Community Partnership,trust,,,,,
25,Brownhills School Trust,trust,,,,,
26,Best Futures,trust,,,,,
27,South Liverpool Education Trust,trust,,,,company:07030660,SOUTH LIVERPOOL EDUCATION TRUST
28,The Fiveways Trust,trust,,,,company:06530527,THE FIVEWAYS TRUST
29,Parklands Trust,trust,,,,company:07031130,PARKLANDS TRUST
30,Rainhill Learning Village Trust,trust,,,,company:07088409,RAINHILL LEARNING VILLAGE TRUST
31,The Wrekin Co-operative Learning Trust,trust,,,,company:08180449,THE WREKIN CO-OPERATIVE LEARNING TRUST
32,Litherland High School Trust,trust,,,,company:07757429,LITHERLAND HIGH SCHOOL TRUST
33,Bebington High Sports College a Co-operative Community Trust,trust,,,,,
34,St Paul's Academy Limited,single-academy trust,,,,company:05210075,ST PAUL'S ACADEMY LIMITED
35,The Smile Trust (South Manchester International Learning Enterprise),trust,,,,,
36,West Oldham Co-operative Trust,trust,,,,,
37,Failsworth Learning Partnership,trust,,,,company:07210040,FAILSWORTH LEARNING PARTNERSHIP
38,The Radclyffe Co-operative Learning Trust,trust,,,,company:07239650,THE RADCLYFFE CO-OPERATIVE LEARNING TRUST
39,The Golbourne and Lowton Co-operative Learning Partnership Trust,trust,,,,,
40,The Golborne and Lowton Co-operative Learning Partnership Trust,trust,,,,,
41,Winstanley Abraham Guest Trust,trust,,,,company:07137803,WINSTANLEY ABRAHAM GUEST TRUST
42,Brighter Futures Learning Partnership Trust,trust,,,,company:07147060,BRIGHTER FUTURES LEARNING PARTNERSHIP TRUST
43,The Doncaster Co-operative Learning Partnership,trust,,,,company:07172612,DONCASTER CO-OPERATIVE LEARNING PARTNERSHIP
44,The Wath Community Co-operative Trust,trust,,,,company:08647577,THE WATH LEARNING COMMUNITY CO-OPERATIVE TRUST
45,City Community Learning Trust,trust,,,,company:07476344,CITY COMMUNITY LEARNING TRUST
46,The Birley Learning Community Co-operative Trust,trust,,,,company:08645382,THE BIRLEY LEARNING COMMUNITY CO-OPERATIVE TRUST
47,North East Sheffield Trust,trust,,company:08863947,4017,company:08863947,NORTH EAST SHEFFIELD TRUST
48,Westfield Learning Community Trust,trust,,,,company:07422667,WESTFIELD LEARNING COMMUNITY TRUST
49,Lidget Green Community Co-operative Learning Trust,trust,,,,company:08785019,THE LIDGET GREEN COMMUNITY CO-OPERATIVE LEARNING TRUST
50,The Buttershaw Learning and Achievement Trust,trust,,,,company:07112765,BUTTERSHAW LEARNING AND ACHIEVEMENT TRUST
51,Tong High School Trust,trust,,,,company:07210410,TONG HIGH SCHOOL TRUST
52,The Nab Wood Community Trust,trust,,,,,
53,Thornton Grammar and Queensbury School Learning Trust,trust,,,,,
54,The Park Lane Learning Trust,trust,,,,company:07200314,THE PARK LANE LEARNING TRUST
55,Calder Learning Trust,trust,,,,company:09010317,THE CALDER LEARNING TRUST
56,The Spenborough Co-operative Trust,trust,,,,company:08028340,THE SPENBOROUGH CO-OPERATIVE TRUST
57,Aspire Cooperative Learning Trust,trust,,,,company:07632050,ASPIRE CO-OPERATIVE LEARNING TRUST
58,The Honley Co-operative Learning Trust,trust,,,,company:09150163,THE HONLEY CO-OPERATIVE LEARNING TRUST
59,The Dewsbury Learning Trust,trust,,,,company:07137387,THE DEWSBURY LEARNING TRUST
60,Aireborough Learning Partnership,trust,,,,company:08819550,THE AIREBOROUGH LEARNING PARTNERSHIP - A CO-OPERATIVE TRUST
61,The Priesthope Co-operative Learning Trust,trust,,,,,
62,Wharfe Valley Learning Partnership,trust,,,,company:08822970,THE WHARFE VALLEY LEARNING PARTNERSHIP
63,The Lantern Learning Trust (Inner North West Leeds),trust,,,,company:08419368,"THE LANTERN LEARNING TRUST (INNER CITY NORTH, LEEDS)"
64,The Leeds North West Education Partnership Foundation,trust,,,,company:08159893,THE LEEDS NORTH WEST EDUCATION PARTNERSHIP
65,The Leeds East Primary Partnership,trust,,,,company:08330167,THE LEEDS EAST PRIMARY PARTNERSHIP: A CO-OPERATIVE TRUST
66,The Temple Newsam Learning Partnership,trust,,,,company:07323734,THE TEMPLE NEWSAM LEARNING PARTNERSHIP: A CO-OPERATIVE SCHOOLS TRUST
67,The Learning Trust (South Leeds),trust,,,,company:07689558,THE LEARNING TRUST (SOUTH LEEDS)
68,21st Century Learning Partnership,trust,,,,company:07490257,21ST CENTURY LEARNING PARTNERSHIP
69,The Royds Learning Trust,trust,,,,company:08162626,THE ROYDS LEARNING TRUST
70,The Bruntcliffe Co-operative Learning Trust,trust,,,,company:07871729,THE BRUNTCLIFFE CO-OPERATIVE LEARNING TRUST
71,Co-op The Priesthorpe Co-operative Learning Trust,trust,,,,company:08122838,THE INSPIRE CO-OPERATIVE LEARNING TRUST
72,The Education Trust for Wetherby,trust,,,,company:07155299,THE EDUCATION TRUST FOR WETHERBY
73,Excel Learning Trust,trust,,,,company:07080464,EXCEL LEARNING TRUST
74,Education Ossett - Community Trust,trust,,,,company:06655424,EDUCATION OSSETT - COMMUNITY TRUST
75,Pontefract Education Trust,trust,,,,company:07533785,PONTEFRACT EDUCATION TRUST
76,Gosforth Schools' Trust,trust,,,,company:08942309,GOSFORTH SCHOOLS' TRUST
77,Outer West Learning Trust,trust,,,,company:08942398,OUTER WEST LEARNING TRUST
78,The North Tyneside Learning Trust,trust,,,,company:07353837,NORTH TYNESIDE LEARNING TRUST
79,The Bede Co-operative Learning Trust,trust,,,,,
80,South West Bristol Co-operative Learning Trust,trust,,,,company:07196462,SOUTH WEST BRISTOL CO-OPERATIVE LEARNING TRUST
81,South East Bristol Educational Trust,trust,,,,company:08160289,SOUTH EAST BRISTOL EDUCATIONAL TRUST
82,Weston-super-Mare Education Trust,trust,,,,company:08658047,WESTON-SUPER-MARE EDUCATION TRUST
83,Trust in Learning,trust,,,,company:06610908,TRUST IN LEARNING
84,The Platinum Co-operative Trust,trust,,,,company:08554335,THE PLATINUM CO-OPERATIVE LEARNING TRUST
85,W W Trust,trust,,,,,
86,Chipping Sodbury School Co-operative Trust,trust,,,,company:08669980,CHIPPING SODBURY SCHOOL CO-OPERATIVE TRUST
87,Bedfordshire East Schools Trust (BEST),trust,,,,company:06865093,BEDFORDSHIRE EAST SCHOOLS TRUST LIMITED
88,The Leap Trust,trust,,,,company:07066659,LEAP COMMUNITY TRUST
89,North East Bedford Learning Trust,trust,,,,company:06920399,NORTH EAST BEDFORD LEARNING TRUST
90,North Bedfordshire Schools Trust (NBST),trust,,,,company:06406335,NORTH BEDFORDSHIRE SCHOOLS TRUST
91,The Vale of Marston Schools' Trust,trust,,,,company:07362459,THE VALE OF MARSTON SCHOOLS' TRUST
92,Pinnacle Trust,trust,,,,company:07810556,THE PINNACLE TRUST
93,The Harlington Area Schools Trust,trust,,,,company:06664132,THE HARLINGTON AREA SCHOOLS TRUST
94,The Kempston Education Trust (KET),trust,,,,company:06722344,KEMPSTON EDUCATION TRUST
95,The Biddenham Campus Trust,trust,,,,company:07421249,THE BIDDENHAM CAMPUS TRUST
96,Girls' Trust for Educational Excellence and Enterprise,trust,,,,company:06736504,GIRLS' TRUST FOR EDUCATIONAL EXCELLENCE AND ENTERPRISE
97,Wolverton Learning Trust,trust,,,,company:09097648,WOLVERTON LEARNING TRUST
98,The Aylesbury Learning Partnership,trust,,,,company:08670392,THE AYLESBURY LEARNING PARTNERSHIP
99,Cressex Co-operative Learning Partnership,trust,,,,company:07207094,THE CRESSEX CO-OPERATIVE LEARNING TRUST
100,Leon Learning Trust,trust,,,,company:07048537,THE LEON LEARNING TRUST
101,The Henry Morris Community Trust,trust,,,,company:07085883,THE HENRY MORRIS COMMUNITY TRUST
102,The North Cambridge Community Trust,trust,,,,company:07359743,THE NORTH CAMBRIDGE COMMUNITY TRUST
103,Jack Hunt Community Learning Trust,trust,,,,company:07390424,THE JACK HUNT COMMUNITY LEARNING TRUST
104,Alsager Community Trust,trust,,,,company:06981514,THE ALSAGER COMMUNITY TRUST
105,Crewe South Co-operative Learning Partnership,trust,,,,company:07888193,CREWE SOUTH CO-OPERATIVE LEARNING PARTNERSHIP
106,Blacon High School Trust,trust,,,,company:07220749,BLACON HIGH SCHOOL TRUST
107,Seahorse Educational Trust,trust,,,,company:07721328,SEAHORSE EDUCATIONAL TRUST
108,The East Cleveland Co-operative Learning Trust,trust,,,,company:08668189,THE EAST CLEVELAND CO-OPERATIVE LEARNING TRUST
109,The Redcar and Marske Specialist Schools Trust,trust,,,,company:07061055,TRUST4LEARNING
110,The Penwith Education Trust (PET),trust,,,,company:08013075,THE PENWITH EDUCATION TRUST
111,The Helston and Lizard Peninsula Education Trust,trust,,,,company:07001690,SOUTHERLY POINT CO-OPERATIVE EDUCATIONAL TRUST
112,The Redruth Learning Group Trust,trust,,,,company:08368234,THE REDRUTH LEARNING GROUP TRUST
113,Crofty Learning Trust,trust,,,,company:08340994,THE CROFTY LEARNING TRUST
114,Mid Cornwall Co-operative Learning Trust,trust,,,,company:08159946,THE MID CORNWALL CO-OPERATIVE LEARNING TRUST
115,The Lanhydrock Schools Partnership,trust,,,,company:08475586,THE LANHYDROCK SCHOOLS PARTNERSHIP
116,The Camelford Co-operative Learning Trust,trust,,,,company:07321827,MOOR AND COASTAL PARTNERSHIP TRUST
117,The Launceston Rural Learning Trust,trust,,,,company:08194273,THE LAUNCESTON RURAL LEARNING TRUST
118,Launceston Primary Schools Trust,trust,,,,company:08156955,AN DARAS MULTI ACADEMY TRUST
119,The Caradon Co Operative Trust,trust,,,,company:08321322,THE CARADON CO-OPERATIVE EDUCATIONAL TRUST
120,Liskeard Community Co-operative Learning Trust (LCCLT),trust,,,,company:07890869,THE LISKEARD COMMUNITY CO-OPERATIVE LEARNING TRUST
121,Torpoint and Rame Co-operative Trust,trust,,,,company:07889474,TORPOINT AND RAME CO-OPERATIVE LEARNING TRUST
122,St Austell Educational Trust,trust,,,,company:08160093,THE ST AUSTELL EDUCATION TRUST
123,North Pennine Learning Partnership Trust,trust,,,,company:06553173,NORTH PENNINE LEARNING PARTNERSHIP
124,The Sinfin Chellaston Partnership Trust,trust,,,,company:07470285,THE SINFIN CHELLASTON PARTNERSHIP EDUCATIONAL TRUST
125,The Bemrose Littleover Partnership Educational Trust,trust,,,,company:07246485,BEMROSE EDUCATIONAL TRUST
126,Derby Pride Trust,trust,,company:07109892,2880,company:07109892,DERBY PRIDE TRUST
127,The Merrill and Derby College Partnership Trust,trust,,,,company:07514639,THE MERRILL & DERBY COLLEGE PARTNERSHIP TRUST
128,Culm Co=operative Learning Partnership,trust,,,,company:08647797,CULM CO-OPERATIVE LEARNING PARTNERSHIP
129,Exeter Learning Trust,trust,,,,company:08822622,EXETER LEARNING TRUST
130,The Ted Wragg Trust,trust,,,,company:07229092,TED WRAGG TRUST
131,The Avocet Learning Trust,trust,,,,company:08647735,THE AVOCET LEARNING TRUST
132,Smile Learning Trust,trust,,,,company:08752855,THE SMILE LEARNING TRUST
133,Atlantic Coast Co-Operative Trust,trust,,,,company:08528298,ATLANTIC COAST CO-OPERATIVE TRUST
134,The Two Moors Learning Partnership,trust,,,,company:08656101,THE TWO MOORS LEARNING PARTNERSHIP
135,Tavistock Co-Operative Learning Trust,trust,,,,company:08160189,TAVISTOCK CO-OPERATIVE LEARNING TRUST
136,Dartmoor Co-operative Learning Trust,trust,,,,company:08264283,THE DARTMOOR CO-OPERATIVE LEARNING TRUST
137,South West Plymouth Education Trust,trust,,,,company:08160286,THE SOUTH WEST PLYMOUTH EDUCATION TRUST
138,The South West Plymouth Education Trust,trust,,,,company:08160286,THE SOUTH WEST PLYMOUTH EDUCATION TRUST
139,The Lipson Learning Co-operative Trust,trust,,,,company:06969482,LIPSON LEARNING CO-OPERATIVE TRUST
140,Education Through Enterprise Trust,trust,,,,company:08871100,EDUCATION THROUGH ENTERPRISE TRUST
141,The Holsworthy Co-operative Learning Trust Foundation,trust,,,,company:08165701,THE HOLSWORTHY CO-OPERATIVE LEARNING TRUST
142,South Molton Co-operative Learning Trust,trust,,,,company:08334627,SOUTH MOLTON CO-OPERATIVE LEARNING TRUST
143,The Park Community Co-Operative Learning Trust,trust,,,,company:08160073,THE PARK COMMUNITY CO-OPERATIVE LEARNING TRUST
144,The Exe Estuary Academic Co-operative Trust,trust,,,,company:08167897,THE EXE ESTUARY ACADEMIC CO-OPERATIVE TRUST
145,The Torquay Community College Trust,trust,,,,company:07101375,TORQUAY COMMUNITY COLLEGE TRUST
146,Westlands School Trust,trust,,,,,
147,SENtient Trust,trust,,,,company:08159859,SENTIENT TRUST
148,The North Bournemouth Learning and Achievement Trust,trust,,,,company:07512902,THE NORTH BOURNEMOUTH LEARNING AND ACHIEVEMENT TRUST
149,The Glenmoor and Winton Educational Trust,trust,,,,company:07393006,GLENMOOR AND WINTON EDUCATIONAL TRUST
150,Spennymoor Learning Community Trust,trust,,,,company:07240624,SPENNYMOOR LEARNING COMMUNITY TRUST
151,Aycliffe and Shildon Schools Education Trust,trust,,,,company:06998729,AYCLIFFE AND SHILDON SCHOOLS EDUCATION TRUST
152,The Hailsham Co-operative Learning Trust,trust,,,,company:07388613,THE HAILSHAM CO-OPERATIVE LEARNING TRUST
153,The Lewes Co-operative Learning Partnership,trust,,,,company:09162295,THE LEWES CO-OPERATIVE LEARNING PARTNERSHIP
154,Billericay Community Trust,trust,,,,company:06997931,BILLERICAY COMMUNITY TRUST
155,The Harlow Education Trust,trust,,,,company:07344436,THE HARLOW EDUCATION TRUST
156,The South Gloucester Learning Trust,trust,,,,company:07337220,THE SOUTH GLOUCESTER LEARNING TRUST
157,The Lakers Family Co-operative College,trust,,,,company:07320062,THE LAKERS FAMILY CO-OPERATIVE LEARNING TRUST
158,The Vale of Berkeley Co-operative Learning Trust,trust,,,,company:07217965,THE VALE OF BERKELEY CO-OPERATIVE LEARNING TRUST
159,Regents Park Learning Trust,trust,,,,company:07743582,SOUTHAMPTON CO-OPERATIVE LEARNING TRUST
160,Southampton Education Trust,trust,,,,company:06314840,THE SOUTHAMPTON EDUCATION TRUST LIMITED
161,The Upper Shirley Learning Community Trust,trust,,,,company:06852829,UPPER SHIRLEY LEARNING COMMUNITY TRUST
162,The King Richard School Trust,trust,,,,company:07000751,THE KING RICHARD SCHOOL TRUST
163,The City of Portsmouth Boys' Trust,trust,,,,company:07005864,THE CITY OF PORTSMOUTH BOYS' SCHOOL TRUST
164,The Purbrook Park Learning Trust,trust,,,,company:06861495,THE PURBROOK PARK LEARNING TRUST
165,Southampton Co-operative Learning Trust,trust,,,,company:07743582,SOUTHAMPTON CO-OPERATIVE LEARNING TRUST
166,Education for Bromyard: A Co-operative Trust,trust,,,,company:07415377,EDUCATION FOR BROMYARD: A CO-OPERATIVE TRUST
167,The East Hull Co-Operative Trust,trust,,,,company:08161698,THE EAST HULL CO-OPERATIVE LEARNING TRUST
168,Pioneer Co-operative Trust,trust,,,,company:06893415,PIONEER CO-OPERATIVE TRUST
169,West of Hull - Co-operative Learning Trust,trust,,,,company:07475330,WEST HULL COOPERATIVE LEARNING TRUST
170,The Pioneer Co-Operative Trust,trust,,,,company:06893415,PIONEER CO-OPERATIVE TRUST
171,Medina Innovation Trust AKA Island Innovation Trust,trust,,,,company:06793576,ISLAND INNOVATION TRUST
172,Rochester Learning Trust,trust,,,,company:07035082,ROCHESTER LEARNING TRUST
173,The Northfleet School for Girls Co-operative Learning Trust,trust,,,,company:07722857,THE NORTHFLEET SCHOOL FOR GIRLS CO-OPERATIVE LEARNING TRUST
174,The Malling Holmesdale Federation Trust,trust,,,,company:06841092,THE MALLING HOLMESDALE FEDERATION TRUST
175,The Hundred of Hoo School Trust,trust,,,,company:06389366,THE HUNDRED OF HOO NURSERY AND KIDS CLUB LIMITED
176,The Futures Learning Trust,trust,,,,company:06770414,FUTURES LEARNING TRUST
177,Collegiate High School Raising Aspirations Trust,trust,,,,company:06682621,COLLEGIATE HIGH SCHOOL RAISING ASPIRATIONS TRUST
178,TFSP LSA Learning Trust,trust,,,,company:07654281,LYTHAM ST ANNES LEARNING TRUST
179,Glenburn Education Trust,trust,,,,company:07320081,GLENBURN EDUCATION TRUST
180,The Palatine Achievement Trust,trust,,,,company:07182663,PALATINE SPORTS COLLEGE - A LEARNING & ACHIEVEMENT TRUST
181,Fleetwood Education Trust,trust,,,,company:06966733,FLEETWOOD EDUCATION TRUST
182,The Lathom Trust,trust,,,,company:07701959,THE LATHOM TRUST
183,The Loughborough Learning Trust,trust,,,,company:06958522,LOUGHBOROUGH LEARNING TRUST
184,Fullhurst Co-operative Learning Partnership,trust,,,,company:07265955,FULLHURST LEARNING PARTNERSHIP
185,"The WELL (Wellbeing, Enterprise, Leadership and Learning) Trust",trust,,,,,
186,Wolds and East Education Trust,trust,,,,company:06672194,WOLDS AND EAST EDUCATION TRUST
187,Co-op The Aylsham Cluster Trust,trust,,,,company:07662251,AYLSHAM CLUSTER TRUST
188,Acorn Co-operative Learning Alliance,trust,,,,company:09180154,THE ACORN CO-OPERATIVE LEARNING ALLIANCE
189,The Aylsham Cluster Trust,trust,,,,company:07662251,AYLSHAM CLUSTER TRUST
190,The Central Norwich Foundation Trust,trust,,,,company:06910125,CENTRAL NORWICH FOUNDATION TRUST
191,Trust Norfolk,trust,,,,company:08754672,TRUST NORFOLK-SEN
192,The Parkside Community Trust,trust,,,,company:07041876,PARKSIDE COMMUNITY TRUST
193,George Pindar Community Sports College Trust,trust,,,,company:06566468,GEORGE PINDAR COMMUNITY SPORTS COLLEGE TRUST
194,Lodge Park Technology College Trust,trust,,,,,
195,The Ashington Learning Partnership Trust,trust,,,,company:06356262,ASHINGTON LEARNING PARTNERSHIP TRUST
196,The Beacon Co-operative Learning trust,trust,,,,company:08330680,THE BEACON CO-OPERATIVE LEARNING TRUST
197,Severn Community Co-operative Learning Trust,trust,,,,company:08124589,THE SEVERN COMMUNITY CO-OPERATIVE LEARNING TRUST
198,Bridgwater Education Trust,trust,,,,company:06672308,BRIDGWATER EDUCATION TRUST LIMITED
199,Brymore School Trust,trust,,,,company:07322811,BRYMORE SCHOOL TRUST
200,Trust for Innovative Learning and Training,trust,,,,company:07112008,TRUST FOR INNOVATIVE LEARNING AND TRAINING (TILT)
201,Mill Hill Co-operative Learning Trust,trust,,,,company:08160314,MILL HILL CO-OPERATIVE LEARNING TRUST
202,Burton Co-operative Learning Trust,trust,,,,company:07817715,BURTON CO-OPERATIVE LEARNING TRUST
203,The Thomas Boughey Co-operative Learning Trust,trust,,,,company:07299390,THE SIR THOMAS BOUGHEY CO-OPERATIVE LEARNING TRUST
204,Biddulph Schools Partnership Trust,trust,,,,company:08045239,BIDDULPH SCHOOLS PARTNERSHIP TRUST
205,Chase Learning Trust,trust,,,,company:06953695,CHASE LEARNING TRUST
206,Tame Valley Co-Operative Learning Trust,trust,,,,company:08160117,TAME VALLEY CO-OPERATIVE LEARNING TRUST
207,The Newcastle Co-operative Learning Trust,trust,,,,company:08159883,THE NEWCASTLE CO-OPERATIVE LEARNING TRUST
208,Minster Spires Co-operative Learning Trust,trust,,,,company:09069228,THE MINSTER SPIRES CO-OPERATIVE LEARNING TRUST
209,Chase Co-operative Trust,trust,,,,company:08011890,CHASE CO-OPERATIVE LEARNING TRUST
210,The Aston Brooke Co-operative Trust,trust,,,,company:09345706,THE ASTON BROOKE CO-OPERATIVE LEARNING TRUST
211,Stafford Community Learning Trust,trust,,,,company:09648759,STAFFORD COMMUNITY LEARNING TRUST
212,Burnley Education Trust,trust,,,,company:06968373,BURNLEY EDUCATION TRUST
213,Trentham Co-operative Trust,trust,,,,company:07210717,TRENTHAM CO-OPERATIVE TRUST
214,Sandon Learning Partnership Trust,trust,,,,company:07351263,THE SANDON LEARNING PARTNERSHIP TRUST
215,The Sir Thomas Boughey Co-operative Learning Trust,trust,,,,company:07299390,THE SIR THOMAS BOUGHEY CO-OPERATIVE LEARNING TRUST
216,Blythe Bridge High School Music Trust,trust,,,,company:08272480,BLYTHE BRIDGE HIGH SCHOOL MUSIC TRUST
217,Stour Education Trust (SET),trust,,,,company:07066757,STOUR EDUCATION TRUST
218,Felixstowe Learning Trust,trust,,,,company:06998382,FELIXSTOWE LEARNING TRUST
219,The SWISS Trust,trust,,,,,
220,Voice Education Trust,trust,,,,company:07061920,THE VOICE EDUCATION TRUST
221,The Kenilworth Education Trust,trust,,,,company:06809829,KENILWORTH EDUCATION TRUST
222,Bourne Community Trust,trust,,,,company:06860258,BOURNE COMMUNITY TRUST
223,North Wiltshire Learning Trust,trust,,,,company:08645319,NORTH WILTSHIRE LEARNING TRUST
224,Marlowe Academy,single-academy trust,,,,company:04915796,MARLOWE ACADEMY
225,Tudor Grange Academies Trust,multi-academy trust,,company:07365748,5128,company:07365748,TUDOR GRANGE ACADEMIES TRUST
226,Grace Academy,multi-academy trust,,company:04967658,3211,company:04967658,GRACE ACADEMY
227,John Madejski Academy,single-academy trust,,,,company:05319170,JOHN MADEJSKI ACADEMY
228,The Voyager Learning Cooperative,trust,,,,company:07207113,THE VOYAGER LEARNING CO-OPERATIVE
229,Macmillan Academy,single-academy trust,,,,company:02236171,MACMILLAN ACADEMY
230,Dixons Academies Charitable Trust Ltd,multi-academy trust,,company:02303464,2939,company:02303464,DIXONS ACADEMIES CHARITABLE TRUST LTD
231,United Learning Trust,multi-academy trust,,company:04439859,5143,company:04439859,UNITED LEARNING TRUST
232,The Chickenley Community Co-operative Learning Trust,trust,,,,company:08462144,THE CHICKENLEY COMMUNITY CO-OPERATIVE LEARNING TRUST
233,Petchey Academy,single-academy trust,,,,company:05342164,PETCHEY ACADEMY
234,Northern Schools Trust,multi-academy trust,,company:05067702,4041,company:05067702,NORTHERN SCHOOLS TRUST
235,Chase High Trust,trust,,,,company:07131649,CHASE HIGH TRUST
236,Child and Family Learning Trust,trust,,,,company:07875308,CHILD AND FAMILY LEARNING TRUST
237,"Westminster Academy (Westbourne Green), The",single-academy trust,,,,company:05102934,THE WESTMINSTER ACADEMY (WESTBOURNE GREEN)
238,The Magnus Learning Trust,trust,,,,company:07001636,THE MAGNUS LEARNING TRUST
239,Peacehaven Co-operative Learning Trust,trust,,,,company:08624963,THE PEACEHAVEN CO-OPERATIVE LEARNING TRUST
240,"Bridge Academy, Hackney, The",single-academy trust,,,,company:05195911,"THE BRIDGE ACADEMY, HACKNEY"
241,Islington Arts and Media Trust,trust,,,,company:06794689,THE ARTS AND MEDIA SCHOOL ISLINGTON TRUST LTD
242,Lever Park Learning Trust,trust,,,,company:06781652,LEVER PARK LEARNING TRUST
243,Harris Federation,multi-academy trust,,company:06228587,3320,company:06228587,HARRIS FEDERATION
244,ARK Schools,multi-academy trust,,company:05112090,2157,company:05112090,ARK SCHOOLS
245,Bishopsford Educational Trust,trust,,,,company:07054131,BISHOPSFORD EDUCATIONAL TRUST
246,LEAF Academy Trust,multi-academy trust,,company:05037949,3706,company:05037949,LEAF ACADEMY TRUST
247,The Kings College of Arts Trust,trust,,,,,
248,The Royal Docks Co-operative Learning Partnership,trust,,,,company:07268568,THE ROYAL DOCKS CO-OPERATIVE LEARNING PARTNERSHIP
249,New College Leicester Trust,trust,,,,company:07267502,NEW COLLEGE LEICESTER TRUST
250,Kings Community Trust,trust,,,,,
251,The Newcastle Special Schools Trust,trust,,,,company:08684375,NEWCASTLE SPECIAL SCHOOLS TRUST
252,Parkside Creative Learning Trust,trust,,,,company:07738951,PARKSIDE CREATIVE LEARNING TRUST
253,The Link - Beyond The Gate Trust,trust,,,,company:07680729,THE LINK BEYOND THE GATE TRUST
254,Gateway Learning Community,multi-academy trust,,company:05853746,3163,company:05853746,GATEWAY LEARNING COMMUNITY
255,The Hadden Park Co-operative Learning Partnership,trust,,,,company:07163598,THE HADDEN PARK CO-OPERATIVE LEARNING PARTNERSHIP
256,All Saints Church of England College Trust,trust,,,,company:07820834,THE ALL SAINTS CHURCH OF ENGLAND COLLEGE TRUST
257,The City of Cambridge Education Foundation,trust,,,,company:04930419,CITY OF CAMBRIDGE EDUCATION FOUNDATION
258,Greig City Academy,single-academy trust,,,,company:04220486,GREIG CITY ACADEMY
259,Nord Anglia Education Plc.,trust,,,,company:06590752,NORD ANGLIA EDUCATION (UK) HOLDINGS PLC
260,Meadowhead Community Learning Trust,trust,,,,company:06929638,MEADOWHEAD COMMUNITY LEARNING TRUST
261,Walsall City Academy Trust,single-academy trust,,,,company:04251277,WALSALL CITY ACADEMY TRUST
262,Jarrow School Trust,trust,,,,company:07205479,JARROW SCHOOL TRUST
263,Unity City Academy Trust,single-academy trust,,,,company:04357009,UNITY CITY ACADEMY TRUST
264,Bexley Business Academy Limited,single-academy trust,,,,company:04701198,BEXLEY BUSINESS ACADEMY EDUCATION SERVICES LIMITED
265,CFBT Schools Trust,multi-academy trust,,company:07468210,2597,company:07468210,CFBT SCHOOLS TRUST
266,Cabot Learning Federation,multi-academy trust,,company:06207590,2516,company:06207590,CABOT LEARNING FEDERATION
267,City of London Academies Trust,multi-academy trust,,company:04504128,2705,company:04504128,CITY OF LONDON ACADEMIES TRUST
268,"King's Academy, The",single-academy trust,,,,company:04418245,THE KING'S ACADEMY
269,"Capital City Academy Trust, The",single-academy trust,,,,company:04268208,THE CAPITAL CITY ACADEMY TRUST
